{
  "_sample": true,
  "speed": 0.8,
  "thresholds": {
    "short_ratio_median": 0.214,
    "ratio_65plus_median": 0.222
  },
  "items": [
    {
      "adm_cd": "21090730",
      "adm_name": "우1동",
      "sido": "부산광역시",
      "sigungu": "해운대구",
      "n_analyzed": 11,
      "n_short": 1,
      "short_ratio": 0.091,
      "mean_gap_s": 5,
      "ratio_65plus": 0.213,
      "quadrant": "low_low",
      "n_candidate": 0,
      "low_sample": false
    },
    {
      "adm_cd": "21090740",
      "adm_name": "우2동",
      "sido": "부산광역시",
      "sigungu": "해운대구",
      "n_analyzed": 51,
      "n_short": 12,
      "short_ratio": 0.235,
      "mean_gap_s": 2.4,
      "ratio_65plus": 0.262,
      "quadrant": "high_high",
      "n_candidate": 10,
      "low_sample": false
    },
    {
      "adm_cd": "21090530",
      "adm_name": "중1동",
      "sido": "부산광역시",
      "sigungu": "해운대구",
      "n_analyzed": 23,
      "n_short": 3,
      "short_ratio": 0.13,
      "mean_gap_s": 2.9,
      "ratio_65plus": 0.196,
      "quadrant": "low_low",
      "n_candidate": 1,
      "low_sample": false
    },
    {
      "adm_cd": "21090540",
      "adm_name": "중2동",
      "sido": "부산광역시",
      "sigungu": "해운대구",
      "n_analyzed": 56,
      "n_short": 20,
      "short_ratio": 0.357,
      "mean_gap_s": 2.2,
      "ratio_65plus": 0.129,
      "quadrant": "high_low",
      "n_candidate": 9,
      "low_sample": false
    },
    {
      "adm_cd": "21090560",
      "adm_name": "송정동",
      "sido": "부산광역시",
      "sigungu": "해운대구",
      "n_analyzed": 3,
      "n_short": 1,
      "short_ratio": 0.333,
      "mean_gap_s": 3.4,
      "ratio_65plus": 0.353,
      "quadrant": null,
      "n_candidate": 0,
      "low_sample": true
    },
    {
      "adm_cd": "21090580",
      "adm_name": "반여2동",
      "sido": "부산광역시",
      "sigungu": "해운대구",
      "n_analyzed": 19,
      "n_short": 3,
      "short_ratio": 0.158,
      "mean_gap_s": 4.9,
      "ratio_65plus": 0.368,
      "quadrant": "low_high",
      "n_candidate": 2,
      "low_sample": false
    },
    {
      "adm_cd": "21090590",
      "adm_name": "반여3동",
      "sido": "부산광역시",
      "sigungu": "해운대구",
      "n_analyzed": 55,
      "n_short": 10,
      "short_ratio": 0.182,
      "mean_gap_s": 3.9,
      "ratio_65plus": 0.168,
      "quadrant": "low_low",
      "n_candidate": 7,
      "low_sample": false
    },
    {
      "adm_cd": "21090620",
      "adm_name": "반송2동",
      "sido": "부산광역시",
      "sigungu": "해운대구",
      "n_analyzed": 61,
      "n_short": 9,
      "short_ratio": 0.148,
      "mean_gap_s": 5.9,
      "ratio_65plus": 0.267,
      "quadrant": "low_high",
      "n_candidate": 4,
      "low_sample": false
    },
    {
      "adm_cd": "21090640",
      "adm_name": "재송1동",
      "sido": "부산광역시",
      "sigungu": "해운대구",
      "n_analyzed": 54,
      "n_short": 10,
      "short_ratio": 0.185,
      "mean_gap_s": 2,
      "ratio_65plus": 0.333,
      "quadrant": "low_high",
      "n_candidate": 5,
      "low_sample": false
    },
    {
      "adm_cd": "21090650",
      "adm_name": "재송2동",
      "sido": "부산광역시",
      "sigungu": "해운대구",
      "n_analyzed": 41,
      "n_short": 10,
      "short_ratio": 0.244,
      "mean_gap_s": 2.6,
      "ratio_65plus": 0.207,
      "quadrant": "high_low",
      "n_candidate": 5,
      "low_sample": false
    },
    {
      "adm_cd": "21090660",
      "adm_name": "좌1동",
      "sido": "부산광역시",
      "sigungu": "해운대구",
      "n_analyzed": 61,
      "n_short": 15,
      "short_ratio": 0.246,
      "mean_gap_s": 4.9,
      "ratio_65plus": 0.309,
      "quadrant": "high_high",
      "n_candidate": 9,
      "low_sample": false
    },
    {
      "adm_cd": "21090670",
      "adm_name": "좌2동",
      "sido": "부산광역시",
      "sigungu": "해운대구",
      "n_analyzed": 65,
      "n_short": 19,
      "short_ratio": 0.292,
      "mean_gap_s": 5.4,
      "ratio_65plus": 0.348,
      "quadrant": "high_high",
      "n_candidate": 15,
      "low_sample": false
    },
    {
      "adm_cd": "21090680",
      "adm_name": "좌3동",
      "sido": "부산광역시",
      "sigungu": "해운대구",
      "n_analyzed": 28,
      "n_short": 6,
      "short_ratio": 0.214,
      "mean_gap_s": 2,
      "ratio_65plus": 0.201,
      "quadrant": "high_low",
      "n_candidate": 3,
      "low_sample": false
    },
    {
      "adm_cd": "21090690",
      "adm_name": "좌4동",
      "sido": "부산광역시",
      "sigungu": "해운대구",
      "n_analyzed": 3,
      "n_short": 1,
      "short_ratio": 0.333,
      "mean_gap_s": 1.9,
      "ratio_65plus": 0.365,
      "quadrant": null,
      "n_candidate": 0,
      "low_sample": true
    },
    {
      "adm_cd": "21090700",
      "adm_name": "반여1동",
      "sido": "부산광역시",
      "sigungu": "해운대구",
      "n_analyzed": 13,
      "n_short": 5,
      "short_ratio": 0.385,
      "mean_gap_s": 3.7,
      "ratio_65plus": 0.358,
      "quadrant": "high_high",
      "n_candidate": 3,
      "low_sample": false
    },
    {
      "adm_cd": "21090710",
      "adm_name": "반여4동",
      "sido": "부산광역시",
      "sigungu": "해운대구",
      "n_analyzed": 42,
      "n_short": 3,
      "short_ratio": 0.071,
      "mean_gap_s": 1.6,
      "ratio_65plus": 0.236,
      "quadrant": "low_high",
      "n_candidate": 2,
      "low_sample": false
    },
    {
      "adm_cd": "21090720",
      "adm_name": "반송1동",
      "sido": "부산광역시",
      "sigungu": "해운대구",
      "n_analyzed": 25,
      "n_short": 7,
      "short_ratio": 0.28,
      "mean_gap_s": 1.9,
      "ratio_65plus": 0.313,
      "quadrant": "high_high",
      "n_candidate": 5,
      "low_sample": false
    },
    {
      "adm_cd": "21140510",
      "adm_name": "남천1동",
      "sido": "부산광역시",
      "sigungu": "수영구",
      "n_analyzed": 42,
      "n_short": 17,
      "short_ratio": 0.405,
      "mean_gap_s": 4.1,
      "ratio_65plus": 0.136,
      "quadrant": "high_low",
      "n_candidate": 9,
      "low_sample": false
    },
    {
      "adm_cd": "21140520",
      "adm_name": "남천2동",
      "sido": "부산광역시",
      "sigungu": "수영구",
      "n_analyzed": 47,
      "n_short": 10,
      "short_ratio": 0.213,
      "mean_gap_s": 2.5,
      "ratio_65plus": 0.3,
      "quadrant": "low_high",
      "n_candidate": 5,
      "low_sample": false
    },
    {
      "adm_cd": "21140530",
      "adm_name": "수영동",
      "sido": "부산광역시",
      "sigungu": "수영구",
      "n_analyzed": 27,
      "n_short": 7,
      "short_ratio": 0.259,
      "mean_gap_s": 1.1,
      "ratio_65plus": 0.328,
      "quadrant": "high_high",
      "n_candidate": 5,
      "low_sample": false
    },
    {
      "adm_cd": "21140540",
      "adm_name": "망미1동",
      "sido": "부산광역시",
      "sigungu": "수영구",
      "n_analyzed": 17,
      "n_short": 3,
      "short_ratio": 0.176,
      "mean_gap_s": 1.2,
      "ratio_65plus": 0.181,
      "quadrant": "low_low",
      "n_candidate": 1,
      "low_sample": false
    },
    {
      "adm_cd": "21140550",
      "adm_name": "망미2동",
      "sido": "부산광역시",
      "sigungu": "수영구",
      "n_analyzed": 8,
      "n_short": 2,
      "short_ratio": 0.25,
      "mean_gap_s": 4.1,
      "ratio_65plus": 0.222,
      "quadrant": "high_high",
      "n_candidate": 1,
      "low_sample": false
    },
    {
      "adm_cd": "21140560",
      "adm_name": "광안1동",
      "sido": "부산광역시",
      "sigungu": "수영구",
      "n_analyzed": 3,
      "n_short": 1,
      "short_ratio": 0.333,
      "mean_gap_s": 3.6,
      "ratio_65plus": 0.124,
      "quadrant": null,
      "n_candidate": 0,
      "low_sample": true
    },
    {
      "adm_cd": "21140570",
      "adm_name": "광안2동",
      "sido": "부산광역시",
      "sigungu": "수영구",
      "n_analyzed": 50,
      "n_short": 9,
      "short_ratio": 0.18,
      "mean_gap_s": 5.8,
      "ratio_65plus": 0.206,
      "quadrant": "low_low",
      "n_candidate": 7,
      "low_sample": false
    },
    {
      "adm_cd": "21140580",
      "adm_name": "광안3동",
      "sido": "부산광역시",
      "sigungu": "수영구",
      "n_analyzed": 66,
      "n_short": 24,
      "short_ratio": 0.364,
      "mean_gap_s": 2.9,
      "ratio_65plus": 0.143,
      "quadrant": "high_low",
      "n_candidate": 11,
      "low_sample": false
    },
    {
      "adm_cd": "21140590",
      "adm_name": "광안4동",
      "sido": "부산광역시",
      "sigungu": "수영구",
      "n_analyzed": 24,
      "n_short": 3,
      "short_ratio": 0.125,
      "mean_gap_s": 5.5,
      "ratio_65plus": 0.127,
      "quadrant": "low_low",
      "n_candidate": 1,
      "low_sample": false
    },
    {
      "adm_cd": "21140600",
      "adm_name": "민락동",
      "sido": "부산광역시",
      "sigungu": "수영구",
      "n_analyzed": 59,
      "n_short": 16,
      "short_ratio": 0.271,
      "mean_gap_s": 3.3,
      "ratio_65plus": 0.344,
      "quadrant": "high_high",
      "n_candidate": 13,
      "low_sample": false
    },
    {
      "adm_cd": "21090750",
      "adm_name": "우3동",
      "sido": "부산광역시",
      "sigungu": "해운대구",
      "n_analyzed": 40,
      "n_short": 8,
      "short_ratio": 0.2,
      "mean_gap_s": 1.9,
      "ratio_65plus": 0.135,
      "quadrant": "low_low",
      "n_candidate": 6,
      "low_sample": false
    }
  ]
}
